{
  "manifest_version": 1,
  "case_id": "static_2d.lame_cylinder",
  "case_dir": "/home/huijun/HSTAR_Next/hstar-evolution/cases/golden/static_2d/lame_cylinder",
  "label": "ref2",
  "status": "COMPLETED",
  "binary": {
    "path": "/home/huijun/HSTAR_Next/hstar-evolution/build/release/hstar",
    "sha256": "6df6ea8d18c9fa5d4a5c8a74268ad0105bb78c48fc93a5ed666cf328dffcc98a"
  },
  "build_manifest": {
    "path": "/home/huijun/HSTAR_Next/hstar-evolution/build/release/build-manifest.json",
    "profile": "release",
    "binary_sha256": "6df6ea8d18c9fa5d4a5c8a74268ad0105bb78c48fc93a5ed666cf328dffcc98a"
  },
  "platform": {
    "os": "Linux-6.17.0-35-generic-x86_64-with-glibc2.39",
    "machine": "x86_64",
    "hostname": "FemChat"
  },
  "threads": {
    "OMP_NUM_THREADS": "1",
    "MKL_NUM_THREADS": "1"
  },
  "timeout_seconds": 120.0,
  "input_check_before": {
    "ok": true,
    "problems": []
  },
  "input_check_after": {
    "ok": true,
    "problems": []
  },
  "process": {
    "command": [
      "/home/huijun/HSTAR_Next/hstar-evolution/build/release/hstar"
    ],
    "cwd": "/home/huijun/HSTAR_Next/hstar-evolution/runs/static_2d.lame_cylinder/20260907T052549Z_19a77894_ref2/work",
    "started_at": "2026-09-07T05:25:49+00:00",
    "wall_seconds": 0.032,
    "user_seconds": 0.008657,
    "system_seconds": 0.011132999999999999,
    "max_rss_kib": 24928,
    "returncode": 0,
    "signal": null,
    "timed_out": false,
    "stderr_bytes": 16,
    "stderr_unexpected_lines": [],
    "stderr_crash_pattern": false,
    "inputs_copied": [
      "1.LOA",
      "1.aqu",
      "1.cor",
      "1.ele",
      "1.ftr",
      "1.glb",
      "1.ifs",
      "1.loa",
      "1.man",
      "1.mat",
      "1.nrt",
      "1.opr",
      "1.pre",
      "1.sol",
      "1.tem",
      "inp"
    ]
  },
  "required_output": {
    "file": "1.flavia.res",
    "present": true,
    "bytes": 12622,
    "sha256": "ebfd0a204c2fdf4e67f4ce5fb86f20d72f29f939e7d1237bc924c1a09e83be73",
    "parse": {
      "ok": true,
      "problems": [],
      "summary": {
        "blocks": [
          {
            "name": "DISPLACEMENT",
            "result_type": 2,
            "step": 1.0,
            "components": [],
            "ncomp": 2,
            "nodes": 81,
            "max_abs": 7.5390546e-06
          },
          {
            "name": "STRESS",
            "result_type": 3,
            "step": 1.0,
            "components": [
              "SIGXX",
              "SIGYY",
              "SIGXY",
              "SIGZZ"
            ],
            "ncomp": 4,
            "nodes": 81,
            "max_abs": 146790.23
          }
        ]
      }
    }
  },
  "outputs": [
    {
      "name": "1.act",
      "bytes": 1637,
      "sha256": "e3d7ba8e0548b6e55882b3b062bd66a958b80efd9cbb1841b1017954e140c7b4"
    },
    {
      "name": "1.bar",
      "bytes": 81,
      "sha256": "6748ad9dfef908b46bc79a4f5f7b6dbb194d050fa4ecccc0e270f012c51d6131"
    },
    {
      "name": "1.bem",
      "bytes": 162,
      "sha256": "0b04385c3212086f53e82e13c20c2c77a382d2b697f9c64f5a2dc1f15214c910"
    },
    {
      "name": "1.chk",
      "bytes": 3604,
      "sha256": "10ee084b47dfcb055b4a805ab592c5a47c7d1901acbe9e85caa40a6ca14e121c"
    },
    {
      "name": "1.ctr",
      "bytes": 254,
      "sha256": "f6b269900501c6a12056f5c7cb9187a040c3c04d4822ca75cbe7c4709b9fb00d"
    },
    {
      "name": "1.ctt",
      "bytes": 0,
      "sha256": null
    },
    {
      "name": "1.dis",
      "bytes": 0,
      "sha256": null
    },
    {
      "name": "1.fai",
      "bytes": 0,
      "sha256": null
    },
    {
      "name": "1.flavia.msh",
      "bytes": 0,
      "sha256": null
    },
    {
      "name": "1.flavia.res",
      "bytes": 12622,
      "sha256": "ebfd0a204c2fdf4e67f4ce5fb86f20d72f29f939e7d1237bc924c1a09e83be73"
    },
    {
      "name": "1.ftf",
      "bytes": 0,
      "sha256": null
    },
    {
      "name": "1.gdm",
      "bytes": 37,
      "sha256": "c5ad17f98d718d5d50e91b3cc1a27ba3fd48257720cf641d58eb06e7f4b140c2"
    },
    {
      "name": "1.gpv",
      "bytes": 28479,
      "sha256": "31b5cb59aba0f4ef05f287084f2e8d1d1bef6cf0d894afff7eccd437551bebde"
    },
    {
      "name": "1.ini",
      "bytes": 0,
      "sha256": null
    },
    {
      "name": "1.inw",
      "bytes": 0,
      "sha256": null
    },
    {
      "name": "1.oew",
      "bytes": 0,
      "sha256": null
    },
    {
      "name": "1.ogw",
      "bytes": 0,
      "sha256": null
    },
    {
      "name": "1.ojw",
      "bytes": 0,
      "sha256": null
    },
    {
      "name": "1.opw",
      "bytes": 0,
      "sha256": null
    },
    {
      "name": "1.res",
      "bytes": 0,
      "sha256": null
    },
    {
      "name": "1.resb",
      "bytes": 0,
      "sha256": null
    },
    {
      "name": "1.rtt",
      "bytes": 26732,
      "sha256": "103eddd1e9bef85eca5c0509f962b762fdac967bdb99401cbbe0933bb2e4e283"
    },
    {
      "name": "1.stf",
      "bytes": 0,
      "sha256": null
    },
    {
      "name": "1.sto",
      "bytes": 0,
      "sha256": null
    }
  ],
  "finished_at": "2026-09-07T05:25:49+00:00",
  "run_dir": "/home/huijun/HSTAR_Next/hstar-evolution/runs/static_2d.lame_cylinder/20260907T052549Z_19a77894_ref2"
}
